<?xml version="1.0" encoding="UTF-8"?>
<!--$Id$ -->
<services xmlns:xsi="http://www.w3.org/2001/XMLSchema-instance"
          xsi:noNamespaceSchemaLocation="https://aweframework.gitlab.io/awe/docs/schemas/services.xsd">

  <!-- SCHEDULER SERVICES -->

  <!-- scheduler tserviceices -->
  <service id="getSchedulerTaskList">
    <java classname="com.almis.awe.scheduler.service.SchedulerService" method="getTaskList"/>
  </service>

  <service id="getTaskProgressStatus">
    <java classname="com.almis.awe.scheduler.service.SchedulerService" method="getTaskProgressStatus">
      <service-parameter type="JSON" name="address"/>
    </java>
  </service>

  <service id="getTaskExecutionList">
    <java classname="com.almis.awe.scheduler.service.SchedulerService" method="getTaskExecutionList">
      <service-parameter type="INTEGER" name="taskId"/>
    </java>
  </service>

  <service id="getExecutionsToPurge">
    <java classname="com.almis.awe.scheduler.service.SchedulerService" method="getExecutionsToPurge">
      <service-parameter type="INTEGER" name="taskId"/>
      <service-parameter type="INTEGER" name="executions"/>
    </java>
  </service>

  <service id="pauseTask">
    <java classname="com.almis.awe.scheduler.service.SchedulerService" method="pauseTask">
      <service-parameter name="IdeTsk" type="INTEGER"/>
    </java>
  </service>
  <service id="resumeTask">
    <java classname="com.almis.awe.scheduler.service.SchedulerService" method="resumeTask">
      <service-parameter name="IdeTsk" type="INTEGER"/>
    </java>
  </service>
  <service id="executeTaskNow">
    <java classname="com.almis.awe.scheduler.service.SchedulerService" method="executeTaskNow">
      <service-parameter name="taskIde" type="INTEGER"/>
    </java>
  </service>
  <service id="insertSchedulerTask">
    <java classname="com.almis.awe.scheduler.service.SchedulerService" method="insertSchedulerTask">
      <service-parameter name="IdeTsk" type="INTEGER"/>
      <service-parameter name="SendStatus" type="INTEGER" list="true"/>
      <service-parameter name="SendDestination" type="INTEGER" list="true"/>
    </java>
  </service>
  <service id="updateSchedulerTask">
    <java classname="com.almis.awe.scheduler.service.SchedulerService" method="updateSchedulerTask">
      <service-parameter name="IdeTsk" type="INTEGER"/>
      <service-parameter name="SendStatus" type="INTEGER" list="true"/>
      <service-parameter name="SendDestination" type="INTEGER" list="true"/>
    </java>
  </service>
  <service id="deleteSchedulerTask">
    <java classname="com.almis.awe.scheduler.service.SchedulerService" method="deleteSchedulerTask">
      <service-parameter name="IdeTsk" type="INTEGER" list="true"/>
    </java>
  </service>

  <service id="updateExecutionTime">
    <java classname="com.almis.awe.scheduler.service.SchedulerService" method="updateExecutionTime">
      <service-parameter name="taskId" type="INTEGER"/>
      <service-parameter name="taskExecution" type="INTEGER"/>
    </java>
  </service>

  <!-- Scheduler calenserviceices -->
  <service id="insertSchedulerCalendar">
    <java classname="com.almis.awe.scheduler.service.SchedulerService" method="insertSchedulerCalendar">
      <service-parameter name="calendarIde" type="INTEGER"/>
    </java>
  </service>
  <service id="updateSchedulerCalendar">
    <java classname="com.almis.awe.scheduler.service.SchedulerService" method="updateSchedulerCalendar">
      <service-parameter name="calendarIde" type="INTEGER"/>
    </java>
  </service>
  <service id="deleteSchedulerCalendar">
    <java classname="com.almis.awe.scheduler.service.SchedulerService" method="deleteSchedulerCalendar">
      <service-parameter name="calendarIde" type="INTEGER" list="true"/>
    </java>
  </service>
  <service id="checkTriggerContainsCalendar">
    <java classname="com.almis.awe.scheduler.service.SchedulerService" method="checkCalendarExist">
      <service-parameter name="calendarIde" type="INTEGER" list="true"/>
    </java>
  </service>
  <service id="deactivateSchedulerCalendar">
    <java classname="com.almis.awe.scheduler.service.SchedulerService" method="deactivateCalendar">
      <service-parameter name="calendarIde" type="INTEGER" list="true"/>
    </java>
  </service>
  <service id="activateSchedulerCalendar">
    <java classname="com.almis.awe.scheduler.service.SchedulerService" method="activateCalendar">
      <service-parameter name="calendarIde" type="INTEGER" list="true"/>
    </java>
  </service>

  <service id="loadMaintainVariables">
    <java classname="com.almis.awe.scheduler.service.SchedulerService" method="loadMaintainVariables">
      <service-parameter name="maintainStr" type="STRING"/>
    </java>
  </service>

  <service id="nextExecutions">
    <java classname="com.almis.awe.scheduler.service.SchedulerService" method="computeNextFiretimes">
      <service-parameter name="fireTimes" type="INTEGER"/>
    </java>
  </service>

  <!-- Year select/suggest service, returns the next 100 years -->
  <service id="yearSelectService">
    <java classname="com.almis.awe.scheduler.service.SchedulerService" method="yearSelectService"/>
  </service>

  <service id="startScheduler" launch-phase="APPLICATION_START">
    <java classname="com.almis.awe.scheduler.service.SchedulerService" method="start"/>
  </service>

  <service id="stopScheduler">
    <java classname="com.almis.awe.scheduler.service.SchedulerService" method="stop"/>
  </service>

  <service id="restartScheduler">
    <java classname="com.almis.awe.scheduler.service.SchedulerService" method="restart"/>
  </service>

  <service id="clearAndStop">
    <java classname="com.almis.awe.scheduler.service.SchedulerService" method="clearAndStop"/>
  </service>

  <service id="currentlyExecutingJobs">
    <java classname="com.almis.awe.scheduler.service.SchedulerService" method="currentlyExecutingJobs"/>
  </service>

  <service id="getConfiguredJobs">
    <java classname="com.almis.awe.scheduler.service.SchedulerService" method="getConfiguredJobs"/>
  </service>

  <service id="getSchedulerMetadata">
    <java classname="com.almis.awe.scheduler.service.SchedulerService" method="getSchedulerMetadata"/>
  </service>

  <service id="loadExecutionScreen">
    <java classname="com.almis.awe.scheduler.service.SchedulerService" method="loadExecutionScreen">
      <service-parameter name="executionLogPath" type="STRING"/>
      <service-parameter name="address" type="JSON" />
    </java>
  </service>

  <service id="reloadExecutionScreen">
    <java classname="com.almis.awe.scheduler.service.SchedulerService" method="reloadExecutionScreen">
      <service-parameter name="taskId" type="INTEGER"/>
      <service-parameter name="executionId" type="INTEGER" />
    </java>
  </service>

  <service id="purgeExecutionLogs">
    <java classname="com.almis.awe.scheduler.service.SchedulerService" method="purgeExecutionLogs">
      <service-parameter name="taskId" type="INTEGER"/>
      <service-parameter name="executions" type="INTEGER" />
    </java>
  </service>

  <service id="purgeExecutionsAtStart" launch-phase="APPLICATION_START">
    <java classname="com.almis.awe.scheduler.service.SchedulerService" method="purgeExecutionsAtStart"/>
  </service>

</services>
